<?xml version="1.0" encoding="UTF-8"?>
<!DOCTYPE portfolio SYSTEM "portfolio.dtd">
<!--
    portfolio.xml
    Source de données principale du portfolio de Riham Kaddour Bakir
    Web Sémantique - Sup Galilée / Université Sorbonne Paris Nord
    Structure inspirée du format TMX 1.4 (Translation Memory eXchange)
    Chaque bloc de contenu est identifié par un id et décliné par langue.
-->
<portfolio version="1.0" defaultLang="fr">

    <!-- =====================================================================
         META : Métadonnées du site
         ===================================================================== -->
    <meta>
        <langs>
            <lang code="fr" label="Français"  dir="ltr" flag="🇫🇷"/>
            <lang code="en" label="English"   dir="ltr" flag="🇬🇧"/>
            <lang code="ar" label="العربية"   dir="rtl" flag="🇩🇿"/>
        </langs>

        <siteTitle>
            <translation lang="fr">Portfolio – Riham Kaddour Bakir</translation>
            <translation lang="en">Portfolio – Riham Kaddour Bakir</translation>
            <translation lang="ar">ملف أعمال – ريهام قدور بكير</translation>
        </siteTitle>

        <siteDescription>
            <translation lang="fr">Portfolio professionnel de Riham Kaddour Bakir, ingénieure informatique en alternance chez GRDF, spécialisée en développement web, data analysis et systèmes informatiques.</translation>
            <translation lang="en">Professional portfolio of Riham Kaddour Bakir, computer engineering student on apprenticeship at GRDF, specialising in web development, data analysis and information systems.</translation>
            <translation lang="ar">ملف الأعمال المهني لريهام قدور بكير، طالبة هندسة معلوماتية في برنامج التدريب المتناوب بشركة GRDF، متخصصة في تطوير الويب وتحليل البيانات وأنظمة المعلومات.</translation>
        </siteDescription>

        <keywords>
            <translation lang="fr">portfolio, développement web, PHP, data analysis, Power BI, SQL, ingénieure informatique, alternance, GRDF, Sup Galilée</translation>
            <translation lang="en">portfolio, web development, PHP, data analysis, Power BI, SQL, computer engineer, apprenticeship, GRDF, Sup Galilée</translation>
            <translation lang="ar">ملف أعمال، تطوير الويب، PHP، تحليل البيانات، Power BI، SQL، هندسة المعلوماتية، GRDF</translation>
        </keywords>
    </meta>

    <!-- =====================================================================
         IDENTITY : Informations personnelles
         ===================================================================== -->
    <identity>
        <fullName>Riham Kaddour Bakir</fullName>

        <title>
            <translation lang="fr">Ingénieure Informatique en Alternance</translation>
            <translation lang="en">Computer Engineering Apprentice</translation>
            <translation lang="ar">طالبة هندسة معلوماتية – تدريب متناوب</translation>
        </title>

        <tagline>
            <translation lang="fr">Développement · Data · Systèmes — Sup Galilée · Université Sorbonne Paris Nord</translation>
            <translation lang="en">Development · Data · Systems — Sup Galilée · Université Sorbonne Paris Nord</translation>
            <translation lang="ar">تطوير · بيانات · أنظمة — Sup Galilée · جامعة سوربون باريس نور</translation>
        </tagline>

        <photo
            src="assets/img/riham-photo.jpg"
            alt_fr="Photo de profil de Riham Kaddour Bakir"
            alt_en="Profile picture of Riham Kaddour Bakir"
            alt_ar="صورة الملف الشخصي لريهام قدور بكير"
        />

        <location>Île-de-France, France</location>
        <email>kaddourbakirriham@gmail.com</email>
        <phone>+33 6 95 88 97 44</phone>

        <linkedin
            url="https://www.linkedin.com/in/riham-kaddour-bakir"
            label="Riham Kaddour Bakir"
        />
        <github
            url="https://github.com/riham-kb"
            label="riham-kb"
        />
        <portfolio_url>TODO: Remplacer par l'URL du site une fois hébergé</portfolio_url>
    </identity>

    <!-- =====================================================================
         ABOUT : Présentation personnelle
         ===================================================================== -->
    <about>
        <sectionTitle>
            <translation lang="fr">À propos</translation>
            <translation lang="en">About me</translation>
            <translation lang="ar">من أنا</translation>
        </sectionTitle>

        <content lang="fr">Étudiante ingénieure en informatique à Sup Galilée (Université Sorbonne Paris Nord), je suis actuellement en alternance chez GRDF en tant que chargée de mission systèmes informatiques. Passionnée par la data, le développement et les systèmes d'information, j'aime transformer des données brutes en insights exploitables et construire des solutions techniques qui ont un impact concret. Mon double ancrage en développement logiciel et en analyse de données me permet d'avoir une vision transversale des projets informatiques. Je cherche à m'épanouir dans un environnement stimulant, innovant et orienté résultats.</content>

        <content lang="en">I am a computer engineering student at Sup Galilée (Université Sorbonne Paris Nord), currently on an apprenticeship at GRDF as an IT systems project officer. Passionate about data, development and information systems, I enjoy turning raw data into actionable insights and building technical solutions with real-world impact. My dual background in software development and data analysis gives me a cross-functional perspective on IT projects. I thrive in stimulating, innovative and results-driven environments.</content>

        <content lang="ar">أنا طالبة هندسة معلوماتية في مدرسة Sup Galilée (جامعة سوربون باريس نور)، وأعمل حاليًا في برنامج التدريب المتناوب بشركة GRDF بصفة مكلفة بمهام أنظمة المعلومات. أنا شغوفة بالبيانات والتطوير وأنظمة المعلومات، وأستمتع بتحويل البيانات الخام إلى رؤى قابلة للتطبيق وبناء حلول تقنية ذات أثر حقيقي. تجمعي خلفية مزدوجة في تطوير البرمجيات وتحليل البيانات تمنحني رؤية شاملة للمشاريع المعلوماتية. أبحث عن بيئة عمل محفّزة ومبتكرة وموجهة نحو النتائج.</content>
    </about>

    <!-- =====================================================================
         EDUCATION : Formation
         ===================================================================== -->
    <education>
        <sectionTitle>
            <translation lang="fr">Formation</translation>
            <translation lang="en">Education</translation>
            <translation lang="ar">التكوين الأكاديمي</translation>
        </sectionTitle>

        <degree id="edu-1">
            <institution>
                <translation lang="fr">École d'ingénieurs Sup Galilée – Université Sorbonne Paris Nord</translation>
                <translation lang="en">Sup Galilée Engineering School – Université Sorbonne Paris Nord</translation>
                <translation lang="ar">مدرسة المهندسين Sup Galilée – جامعة سوربون باريس نور</translation>
            </institution>
            <diploma>
                <translation lang="fr">Diplôme d'ingénieur en Informatique (en cours)</translation>
                <translation lang="en">Engineering degree in Computer Science (in progress)</translation>
                <translation lang="ar">دبلوم المهندس في المعلوماتية (قيد الإنجاز)</translation>
            </diploma>
            <period>2024 – 2027</period>
            <location_edu>Villetaneuse, France</location_edu>
            <description>
                <translation lang="fr">Cycle ingénieur orienté développement logiciel, data, systèmes et réseaux, génie logiciel. Formation en alternance avec un rythme d'un mois sur deux en entreprise.</translation>
                <translation lang="en">Engineering programme focused on software development, data science, systems and networks, software engineering. Work-study format with alternating months in company.</translation>
                <translation lang="ar">برنامج هندسي يركز على تطوير البرمجيات والبيانات والأنظمة والشبكات. برنامج تدريب متناوب بمعدل شهر في المؤسسة وشهر في الجامعة.</translation>
            </description>
        </degree>

        <degree id="edu-2">
            <institution>
                <translation lang="fr">École Supérieure d'Informatique (ESI SBA) – Algérie</translation>
                <translation lang="en">Higher School of Computer Science (ESI SBA) – Algeria</translation>
                <translation lang="ar">المدرسة العليا للمعلوماتية (ESI SBA) – الجزائر</translation>
            </institution>
            <diploma>
                <translation lang="fr">Classe préparatoire intégrée – Cycle ingénieur Informatique</translation>
                <translation lang="en">Integrated preparatory class – Computer Science Engineering cycle</translation>
                <translation lang="ar">تحضيري متكامل – دورة المهندس في المعلوماتية</translation>
            </diploma>
            <period>2021 – 2024</period>
            <location_edu>Sidi Bel Abbès, Algérie</location_edu>
            <description>
                <translation lang="fr">Formation intensive en mathématiques, algorithmique, programmation orientée objet, bases de données et systèmes d'exploitation.</translation>
                <translation lang="en">Intensive training in mathematics, algorithms, object-oriented programming, databases and operating systems.</translation>
                <translation lang="ar">تكوين مكثف في الرياضيات والخوارزميات والبرمجة الكائنية وقواعد البيانات وأنظمة التشغيل.</translation>
            </description>
        </degree>

        <degree id="edu-3">
            <institution>
                <translation lang="fr">Lycée Bessedik Ben Yahia – Sidi M'hamed Ben Ali, Algérie</translation>
                <translation lang="en">Bessedik Ben Yahia High School – Sidi M'hamed Ben Ali, Algeria</translation>